+-----------------------------------------------------------------------------
+ Started burn-in of /dev/da1 : Wed Apr  8 18:46:23 PDT 2020
+-----------------------------------------------------------------------------
Hostname: fnas.local
Drive Type: SATA
Drive Brand: Seagate_Constellation
Drive Model: ST32000644NS
Serial Number: 9WM74Z2L
Drive Capacity: 2.00 TB

Test Details:
     Short Test Length: 1 minutes | Sleep: 60 seconds
  Extended Test Length: 334 minutes | Sleep: 20040 seconds
Conveyance Test Length: 2 minutes | Sleep: 120 seconds
---
Smart Test Maximum Polling Time: 4 Hours
Smart Test Recheck Polling Time: 60 Seconds

Log File: ./Dtest-ST32000644NS_9WM74Z2L_04082020-1846.log
Bad Blocks File: ./Dtest-ST32000644NS_9WM74Z2L_04082020-1846.bb


+-----------------------------------------------------------------------------
+ Initial Drive Status
+-----------------------------------------------------------------------------
SMART overall-health self-assessment test result: PASSED


ID# ATTRIBUTE_NAME          FLAG     VALUE WORST THRESH TYPE      UPDATED  WHEN_FAILED RAW_VALUE
  1 Raw_Read_Error_Rate     0x000f   075   063   044    Pre-fail  Always       -       30838818
  3 Spin_Up_Time            0x0003   094   093   000    Pre-fail  Always       -       0
  4 Start_Stop_Count        0x0032   100   100   020    Old_age   Always       -       150
  5 Reallocated_Sector_Ct   0x0033   100   100   036    Pre-fail  Always       -       1
  7 Seek_Error_Rate         0x000f   081   060   030    Pre-fail  Always       -       165629921
  9 Power_On_Hours          0x0032   060   060   000    Old_age   Always       -       35236
 10 Spin_Retry_Count        0x0013   100   100   097    Pre-fail  Always       -       0
 12 Power_Cycle_Count       0x0032   100   100   020    Old_age   Always       -       94
184 End-to-End_Error        0x0032   100   100   099    Old_age   Always       -       0
187 Reported_Uncorrect      0x0032   096   096   000    Old_age   Always       -       4
188 Command_Timeout         0x0032   100   099   000    Old_age   Always       -       11
189 High_Fly_Writes         0x003a   100   100   000    Old_age   Always       -       0
190 Airflow_Temperature_Cel 0x0022   077   052   045    Old_age   Always       -       23 (Min/Max 23/27)
191 G-Sense_Error_Rate      0x0032   100   100   000    Old_age   Always       -       6
192 Power-Off_Retract_Count 0x0032   100   100   000    Old_age   Always       -       88
193 Load_Cycle_Count        0x0032   100   100   000    Old_age   Always       -       664
194 Temperature_Celsius     0x0022   023   048   000    Old_age   Always       -       23 (0 16 0 0 0)
195 Hardware_ECC_Recovered  0x001a   024   017   000    Old_age   Always       -       30838818
197 Current_Pending_Sector  0x0012   100   100   000    Old_age   Always       -       0
198 Offline_Uncorrectable   0x0010   100   100   000    Old_age   Offline      -       0
199 UDMA_CRC_Error_Count    0x003e   200   200   000    Old_age   Always       -       202


ERROR LOG:

No Errors Logged


SMART Self-test log structure revision number 1
No self-tests have been logged.  [To run self-tests, use: smartctl -t]



+-----------------------------------------------------------------------------
+ RUN SMART Short test on drive /dev/da1: Wed Apr  8 18:46:23 PDT 2020
+-----------------------------------------------------------------------------
Short test started, sleeping 60 seconds until it finishes
SATA SMART self-test complete
Finished SMART Short test on drive /dev/da1: Wed Apr  8 18:47:24 PDT 2020

+-----------------------------------------------------------------------------
+ RUN SMART Conveyance test on drive /dev/da1: Wed Apr  8 18:47:24 PDT 2020
+-----------------------------------------------------------------------------
Conveyance test started, sleeping 120 seconds until it finishes
SATA SMART self-test complete
Finished SMART Conveyance test on drive /dev/da1: Wed Apr  8 18:49:24 PDT 2020

+-----------------------------------------------------------------------------
+ RUN SMART Extended test on drive /dev/da1: Wed Apr  8 18:49:24 PDT 2020
+-----------------------------------------------------------------------------
Extended test started, sleeping 20040 seconds until it finishes
SATA SMART self-test complete
Finished SMART Extended test on drive /dev/da1: Thu Apr  9 00:23:24 PDT 2020

+-----------------------------------------------------------------------------
+ RUN badblocks test on drive /dev/da1: Thu Apr  9 00:23:24 PDT 2020
+-----------------------------------------------------------------------------
Checking for bad blocks in read-write mode
From block 0 to 1953514583
Testing with pattern 0xaa: set_o_direct: Inappropriate ioctl for device
done                                                 
Reading and comparing: done                                                 
Testing with pattern 0x55: done                                                 
Reading and comparing: done                                                 
Testing with pattern 0xff: done                                                 
Reading and comparing: done                                                 
Testing with pattern 0x00: done                                                 
Reading and comparing: done                                                 
Pass completed, 0 bad blocks found. (0/0/0 errors)
Finished badblocks test on drive /dev/da1: Fri Apr 10 17:49:04 PDT 2020

+-----------------------------------------------------------------------------
+ RUN SMART Extended test on drive /dev/da1: Fri Apr 10 17:49:04 PDT 2020
+-----------------------------------------------------------------------------
Extended test started, sleeping 20040 seconds until it finishes
SATA SMART self-test complete
Finished SMART Extended test on drive /dev/da1: Fri Apr 10 23:23:04 PDT 2020



+-----------------------------------------------------------------------------
+ COMPLETE SMART Information for drive /dev/da1: Fri Apr 10 23:23:04 PDT 2020
+-----------------------------------------------------------------------------

=== START OF INFORMATION SECTION ===
Model Family:     Seagate Constellation ES (SATA)
Device Model:     ST32000644NS
Serial Number:    9WM74Z2L
LU WWN Device Id: 5 000c50 036003b21
Firmware Version: GG18
User Capacity:    2,000,398,934,016 bytes [2.00 TB]
Sector Size:      512 bytes logical/physical
Rotation Rate:    7200 rpm
Device is:        In smartctl database [for details use: -P show]
ATA Version is:   ATA8-ACS T13/1699-D revision 4
SATA Version is:  SATA 2.6, 3.0 Gb/s
Local Time is:    Fri Apr 10 23:23:04 2020 PDT
SMART support is: Available - device has SMART capability.
SMART support is: Enabled
AAM feature is:   Unavailable
APM feature is:   Unavailable
Rd look-ahead is: Enabled
Write cache is:   Enabled
DSN feature is:   Unavailable
ATA Security is:  Disabled, NOT FROZEN [SEC1]
Wt Cache Reorder: Enabled

SMART overall-health self-assessment test result: PASSED

General SMART Values:
Offline data collection status:  (0x82)	Offline data collection activity
					was completed without error.
					Auto Offline Data Collection: Enabled.
Self-test execution status:      (   0)	The previous self-test routine completed
					without error or no self-test has ever 
					been run.
Total time to complete Offline 
data collection: 		(  625) seconds.
Offline data collection
capabilities: 			 (0x7b) SMART execute Offline immediate.
					Auto Offline data collection on/off support.
					Suspend Offline collection upon new
					command.
					Offline surface scan supported.
					Self-test supported.
					Conveyance Self-test supported.
					Selective Self-test supported.
SMART capabilities:            (0x0003)	Saves SMART data before entering
					power-saving mode.
					Supports SMART auto save timer.
Error logging capability:        (0x01)	Error logging supported.
					General Purpose Logging supported.
Short self-test routine 
recommended polling time: 	 (   1) minutes.
Extended self-test routine
recommended polling time: 	 ( 334) minutes.
Conveyance self-test routine
recommended polling time: 	 (   2) minutes.
SCT capabilities: 	       (0x103d)	SCT Status supported.
					SCT Error Recovery Control supported.
					SCT Feature Control supported.
					SCT Data Table supported.

ID# ATTRIBUTE_NAME          FLAGS    VALUE WORST THRESH FAIL RAW_VALUE
  1 Raw_Read_Error_Rate     POSR--   073   063   044    -    23022705
  3 Spin_Up_Time            PO----   094   093   000    -    0
  4 Start_Stop_Count        -O--CK   100   100   020    -    150
  5 Reallocated_Sector_Ct   PO--CK   100   100   036    -    1
  7 Seek_Error_Rate         POSR--   081   060   030    -    165663539
  9 Power_On_Hours          -O--CK   060   060   000    -    35289
 10 Spin_Retry_Count        PO--C-   100   100   097    -    0
 12 Power_Cycle_Count       -O--CK   100   100   020    -    94
184 End-to-End_Error        -O--CK   100   100   099    -    0
187 Reported_Uncorrect      -O--CK   096   096   000    -    4
188 Command_Timeout         -O--CK   100   099   000    -    11
189 High_Fly_Writes         -O-RCK   100   100   000    -    0
190 Airflow_Temperature_Cel -O---K   077   052   045    -    23 (Min/Max 23/27)
191 G-Sense_Error_Rate      -O--CK   100   100   000    -    6
192 Power-Off_Retract_Count -O--CK   100   100   000    -    88
193 Load_Cycle_Count        -O--CK   100   100   000    -    666
194 Temperature_Celsius     -O---K   023   048   000    -    23 (0 16 0 0 0)
195 Hardware_ECC_Recovered  -O-RC-   025   017   000    -    23022705
197 Current_Pending_Sector  -O--C-   100   100   000    -    0
198 Offline_Uncorrectable   ----C-   100   100   000    -    0
199 UDMA_CRC_Error_Count    -OSRCK   200   200   000    -    202
                            ||||||_ K auto-keep
                            |||||__ C event count
                            ||||___ R error rate
                            |||____ S speed/performance
                            ||_____ O updated online
                            |______ P prefailure warning

General Purpose Log Directory Version 1
SMART           Log Directory Version 1 [multi-sector log support]
Address    Access  R/W   Size  Description
0x00       GPL,SL  R/O      1  Log Directory
0x01       GPL,SL  R/O      1  Summary SMART error log
0x02       GPL,SL  R/O      5  Comprehensive SMART error log
0x03       GPL     R/O      5  Ext. Comprehensive SMART error log
0x06       GPL,SL  R/O      1  SMART self-test log
0x07       GPL     R/O      1  Extended self-test log
0x09       GPL,SL  R/W      1  Selective self-test log
0x10       GPL     R/O      1  NCQ Command Error log
0x11       GPL     R/O      1  SATA Phy Event Counters log
0x12       GPL,SL  R/O      1  SATA NCQ Non-Data log
0x21       GPL     R/O      1  Write stream error log
0x22       GPL     R/O      1  Read stream error log
0x80-0x9f  GPL,SL  R/W     16  Host vendor specific log
0xa1       GPL,SL  VS      20  Device vendor specific log
0xa2       GPL     VS    2248  Device vendor specific log
0xa8       GPL,SL  VS     129  Device vendor specific log
0xa9       GPL,SL  VS       1  Device vendor specific log
0xb0       GPL     VS    2928  Device vendor specific log
0xb6       GPL     VS    1918  Device vendor specific log
0xbd       GPL     VS     252  Device vendor specific log
0xbe-0xbf  GPL     VS   65535  Device vendor specific log
0xe0       GPL,SL  R/W      1  SCT Command/Status
0xe1       GPL,SL  R/W      1  SCT Data Transfer

SMART Extended Comprehensive Error Log Version: 1 (5 sectors)
No Errors Logged

SMART Extended Self-test Log Version: 1 (1 sectors)
Num  Test_Description    Status                  Remaining  LifeTime(hours)  LBA_of_first_error
# 1  Extended offline    Completed without error       00%     35289         -
# 2  Extended offline    Completed without error       00%     35242         -
# 3  Conveyance offline  Completed without error       00%     35236         -
# 4  Short offline       Completed without error       00%     35236         -
# 5  Extended offline    Completed without error       00%     35184         -
# 6  Extended offline    Completed without error       00%     35137         -
# 7  Conveyance offline  Completed without error       00%     35132         -
# 8  Short offline       Completed without error       00%     35132         -
# 9  Short offline       Interrupted (host reset)      60%     35132         -
#10  Short offline       Completed without error       00%     35106         -
#11  Short offline       Completed without error       00%     35100         -
#12  Short offline       Completed without error       00%     35094         -
#13  Short offline       Completed without error       00%     35088         -
#14  Short offline       Completed without error       00%     35082         -
#15  Short offline       Completed without error       00%     35058         -
#16  Short offline       Completed without error       00%     35052         -
#17  Short offline       Completed without error       00%     35046         -
#18  Short offline       Completed without error       00%     35040         -
#19  Short offline       Completed without error       00%     35034         -

SMART Selective self-test log data structure revision number 1
 SPAN  MIN_LBA  MAX_LBA  CURRENT_TEST_STATUS
    1        0        0  Not_testing
    2        0        0  Not_testing
    3        0        0  Not_testing
    4        0        0  Not_testing
    5        0        0  Not_testing
Selective self-test flags (0x0):
  After scanning selected spans, do NOT read-scan remainder of disk.
If Selective self-test is pending on power-up, resume after 0 minute delay.

SCT Status Version:                  3
SCT Version (vendor specific):       522 (0x020a)
SCT Support Level:                   1
Device State:                        Active (0)
Current Temperature:                    23 Celsius
Power Cycle Min/Max Temperature:     23/27 Celsius
Lifetime    Min/Max Temperature:     16/48 Celsius
Under/Over Temperature Limit Count:   0/943

SCT Temperature History Version:     2
Temperature Sampling Period:         1 minute
Temperature Logging Interval:        10 minutes
Min/Max recommended Temperature:      0/ 0 Celsius
Min/Max Temperature Limit:            0/ 0 Celsius
Temperature History Size (Index):    128 (99)

Index    Estimated Time   Temperature Celsius
 100    2020-04-10 02:10    24  *****
 101    2020-04-10 02:20    24  *****
 102    2020-04-10 02:30    24  *****
 103    2020-04-10 02:40    25  ******
 ...    ..(  3 skipped).    ..  ******
 107    2020-04-10 03:20    25  ******
 108    2020-04-10 03:30    24  *****
 109    2020-04-10 03:40    24  *****
 110    2020-04-10 03:50    25  ******
 111    2020-04-10 04:00    24  *****
 ...    ..( 21 skipped).    ..  *****
   5    2020-04-10 07:40    24  *****
   6    2020-04-10 07:50    25  ******
 ...    ..(  5 skipped).    ..  ******
  12    2020-04-10 08:50    25  ******
  13    2020-04-10 09:00    24  *****
  14    2020-04-10 09:10    25  ******
  15    2020-04-10 09:20    24  *****
 ...    ..( 43 skipped).    ..  *****
  59    2020-04-10 16:40    24  *****
  60    2020-04-10 16:50    23  ****
 ...    ..(  6 skipped).    ..  ****
  67    2020-04-10 18:00    23  ****
  68    2020-04-10 18:10    24  *****
 ...    ..( 22 skipped).    ..  *****
  91    2020-04-10 22:00    24  *****
  92    2020-04-10 22:10    23  ****
 ...    ..(  6 skipped).    ..  ****
  99    2020-04-10 23:20    23  ****

SCT Error Recovery Control:
           Read:    100 (10.0 seconds)
          Write:    100 (10.0 seconds)

Device Statistics (GP/SMART Log 0x04) not supported

Pending Defects log (GP Log 0x0c) not supported

SATA Phy Event Counters (GP Log 0x11)
ID      Size     Value  Description
0x000a  2            1  Device-to-host register FISes sent due to a COMRESET
0x0001  2            0  Command failed due to ICRC error
0x0003  2            0  R_ERR response for device-to-host data FIS
0x0004  2            0  R_ERR response for host-to-device data FIS
0x0006  2            0  R_ERR response for device-to-host non-data FIS
0x0007  2            0  R_ERR response for host-to-device non-data FIS

+-----------------------------------------------------------------------------
+ Finished burn-in of /dev/da1 : Fri Apr 10 23:23:04 PDT 2020
+-----------------------------------------------------------------------------
