+-----------------------------------------------------------------------------
+ Started burn-in of /dev/sdb : Fri Sep 20 13:24:42 EDT 2019
+-----------------------------------------------------------------------------
Hostname: cent7
Drive Type: SATA
Drive Brand: Seagate_Barracuda
Drive Model: ST2000DM001-1CH164
Serial Number: W1F2QG2Y
Drive Capacity: 2.00 TB

Test Details:
     Short Test Length: 1 minutes | Sleep: 60 seconds
  Extended Test Length: 270 minutes | Sleep: 16200 seconds
Conveyance Test Length: 2 minutes | Sleep: 120 seconds

Log File: ./Dtest-ST2000DM001-1CH164_W1F2QG2Y_#09202019-1324.log
Bad Blocks File: ./Dtest-ST2000DM001-1CH164_W1F2QG2Y_#09202019-1324.bb


+-----------------------------------------------------------------------------
+ Initial Drive Status
+-----------------------------------------------------------------------------
SMART overall-health self-assessment test result: PASSED


ID# ATTRIBUTE_NAME          FLAG     VALUE WORST THRESH TYPE      UPDATED  WHEN_FAILED RAW_VALUE
  1 Raw_Read_Error_Rate     0x000f   112   099   006    Pre-fail  Always       -       3072
  3 Spin_Up_Time            0x0003   095   093   000    Pre-fail  Always       -       0
  4 Start_Stop_Count        0x0032   099   099   020    Old_age   Always       -       1545
  5 Reallocated_Sector_Ct   0x0033   100   100   010    Pre-fail  Always       -       0
  7 Seek_Error_Rate         0x000f   069   060   030    Pre-fail  Always       -       10299506
  9 Power_On_Hours          0x0032   092   092   000    Old_age   Always       -       7674
 10 Spin_Retry_Count        0x0013   100   100   097    Pre-fail  Always       -       0
 12 Power_Cycle_Count       0x0032   100   100   020    Old_age   Always       -       73
183 Runtime_Bad_Block       0x0032   091   091   000    Old_age   Always       -       9
184 End-to-End_Error        0x0032   100   100   099    Old_age   Always       -       0
187 Reported_Uncorrect      0x0032   100   100   000    Old_age   Always       -       0
188 Command_Timeout         0x0032   100   100   000    Old_age   Always       -       7 11 11
189 High_Fly_Writes         0x003a   069   069   000    Old_age   Always       -       31
190 Airflow_Temperature_Cel 0x0022   071   052   045    Old_age   Always       -       29 (0 9 33 26 0)
191 G-Sense_Error_Rate      0x0032   100   100   000    Old_age   Always       -       0
192 Power-Off_Retract_Count 0x0032   100   100   000    Old_age   Always       -       62
193 Load_Cycle_Count        0x0032   099   099   000    Old_age   Always       -       2190
194 Temperature_Celsius     0x0022   029   048   000    Old_age   Always       -       29 (128 0 0 0 0)
197 Current_Pending_Sector  0x0012   100   100   000    Old_age   Always       -       0
198 Offline_Uncorrectable   0x0010   100   100   000    Old_age   Offline      -       0
199 UDMA_CRC_Error_Count    0x003e   200   188   000    Old_age   Always       -       14
240 Head_Flying_Hours       0x0000   100   253   000    Old_age   Offline      -       3322h+22m+50.579s
241 Total_LBAs_Written      0x0000   100   253   000    Old_age   Offline      -       34536345454
242 Total_LBAs_Read         0x0000   100   253   000    Old_age   Offline      -       94608571158


ERROR LOG:

No Errors Logged


SMART Self-test log structure revision number 1
Num  Test_Description    Status                  Remaining  LifeTime(hours)  LBA_of_first_error
# 1  Extended offline    Completed without error       00%      7656         -
# 2  Extended offline    Completed without error       00%      7619         -
# 3  Conveyance offline  Completed without error       00%      7614         -
# 4  Short offline       Completed without error       00%      7614         -
# 5  Extended offline    Completed without error       00%      7603         -
# 6  Conveyance offline  Completed without error       00%      7599         -
# 7  Short offline       Completed without error       00%      7599         -
# 8  Conveyance offline  Completed without error       00%      7599         -
# 9  Short offline       Completed without error       00%      7599         -
#10  Conveyance offline  Completed without error       00%      7598         -
#11  Short offline       Completed without error       00%      7598         -
#12  Short offline       Completed without error       00%      7565         -
#13  Short offline       Completed without error       00%      7565         -
#14  Extended offline    Completed without error       00%        57         -
#15  Conveyance offline  Completed without error       00%        53         -
#16  Short offline       Completed without error       00%        53         -



+-----------------------------------------------------------------------------
+ RUN SMART Short test on drive /dev/sdb: Fri Sep 20 13:24:42 EDT 2019
+-----------------------------------------------------------------------------
Short test started, sleeping 60 seconds until it finishes
SATA SMART self-test complete
# 1  Short offline       Completed without error       00%      7674         -
Finished SMART Short test on drive /dev/sdb: Fri Sep 20 13:25:43 EDT 2019

+-----------------------------------------------------------------------------
+ RUN SMART Conveyance test on drive /dev/sdb: Fri Sep 20 13:25:43 EDT 2019
+-----------------------------------------------------------------------------
Conveyance test started, sleeping 120 seconds until it finishes
SATA SMART self-test complete
# 1  Conveyance offline  Completed without error       00%      7674         -
Finished SMART Conveyance test on drive /dev/sdb: Fri Sep 20 13:27:43 EDT 2019

+-----------------------------------------------------------------------------
+ RUN SMART Extended test on drive /dev/sdb: Fri Sep 20 13:27:43 EDT 2019
+-----------------------------------------------------------------------------
Extended test started, sleeping 16200 seconds until it finishes
SATA SMART self-test complete
# 1  Extended offline    Completed without error       00%      7678         -
Finished SMART Extended test on drive /dev/sdb: Fri Sep 20 17:57:44 EDT 2019

+-----------------------------------------------------------------------------
+ RUN badblocks test on drive /dev/sdb: Fri Sep 20 17:57:44 EDT 2019
+-----------------------------------------------------------------------------
Checking for bad blocks in read-write mode
From block 0 to 1953514583
Testing with pattern 0xaa: done                                                 
Reading and comparing: done                                                 
Testing with pattern 0x55: done                                                 
Reading and comparing: done                                                 
Testing with pattern 0xff: done                                                 
Reading and comparing: done                                                 
Testing with pattern 0x00: done                                                 
Reading and comparing: done                                                 
Pass completed, 0 bad blocks found. (0/0/0 errors)
Finished badblocks test on drive /dev/sdb: Sun Sep 22 03:19:14 EDT 2019

+-----------------------------------------------------------------------------
+ RUN SMART Extended test on drive /dev/sdb: Sun Sep 22 03:19:14 EDT 2019
+-----------------------------------------------------------------------------
Extended test started, sleeping 16200 seconds until it finishes
SATA SMART self-test complete
# 1  Extended offline    Completed without error       00%      7716         -
Finished SMART Extended test on drive /dev/sdb: Sun Sep 22 07:49:14 EDT 2019



+-----------------------------------------------------------------------------
+ COMPLETE SMART Information for drive /dev/sdb: Sun Sep 22 07:49:15 EDT 2019
+-----------------------------------------------------------------------------

=== START OF INFORMATION SECTION ===
Model Family:     Seagate Barracuda 7200.14 (AF)
Device Model:     ST2000DM001-1CH164
Serial Number:    W1F2QG2Y
LU WWN Device Id: 5 000c50 0605329cf
Firmware Version: CC26
User Capacity:    2,000,398,934,016 bytes [2.00 TB]
Sector Sizes:     512 bytes logical, 4096 bytes physical
Rotation Rate:    7200 rpm
Form Factor:      3.5 inches
Device is:        In smartctl database [for details use: -P show]
ATA Version is:   ATA8-ACS T13/1699-D revision 4
SATA Version is:  SATA 3.0, 6.0 Gb/s (current: 3.0 Gb/s)
Local Time is:    Sun Sep 22 07:49:15 2019 EDT
SMART support is: Available - device has SMART capability.
SMART support is: Enabled
AAM feature is:   Unavailable
APM level is:     128 (minimum power consumption without standby)
Rd look-ahead is: Enabled
Write cache is:   Enabled
ATA Security is:  Disabled, NOT FROZEN [SEC1]
Wt Cache Reorder: Unavailable

SMART overall-health self-assessment test result: PASSED

General SMART Values:
Offline data collection status:  (0x00)	Offline data collection activity
					was never started.
					Auto Offline Data Collection: Disabled.
Self-test execution status:      (   0)	The previous self-test routine completed
					without error or no self-test has ever 
					been run.
Total time to complete Offline 
data collection: 		(  609) seconds.
Offline data collection
capabilities: 			 (0x73) SMART execute Offline immediate.
					Auto Offline data collection on/off support.
					Suspend Offline collection upon new
					command.
					No Offline surface scan supported.
					Self-test supported.
					Conveyance Self-test supported.
					Selective Self-test supported.
SMART capabilities:            (0x0003)	Saves SMART data before entering
					power-saving mode.
					Supports SMART auto save timer.
Error logging capability:        (0x01)	Error logging supported.
					General Purpose Logging supported.
Short self-test routine 
recommended polling time: 	 (   1) minutes.
Extended self-test routine
recommended polling time: 	 ( 270) minutes.
Conveyance self-test routine
recommended polling time: 	 (   2) minutes.
SCT capabilities: 	       (0x3085)	SCT Status supported.

ID# ATTRIBUTE_NAME          FLAGS    VALUE WORST THRESH FAIL RAW_VALUE
  1 Raw_Read_Error_Rate     POSR--   119   099   006    -    216609248
  3 Spin_Up_Time            PO----   095   093   000    -    0
  4 Start_Stop_Count        -O--CK   099   099   020    -    1545
  5 Reallocated_Sector_Ct   PO--CK   100   100   010    -    0
  7 Seek_Error_Rate         POSR--   069   060   030    -    10325818
  9 Power_On_Hours          -O--CK   092   092   000    -    7716
 10 Spin_Retry_Count        PO--C-   100   100   097    -    0
 12 Power_Cycle_Count       -O--CK   100   100   020    -    73
183 Runtime_Bad_Block       -O--CK   091   091   000    -    9
184 End-to-End_Error        -O--CK   100   100   099    -    0
187 Reported_Uncorrect      -O--CK   100   100   000    -    0
188 Command_Timeout         -O--CK   100   100   000    -    7 11 11
189 High_Fly_Writes         -O-RCK   052   052   000    -    48
190 Airflow_Temperature_Cel -O---K   067   052   045    -    33 (0 9 35 26 0)
191 G-Sense_Error_Rate      -O--CK   100   100   000    -    0
192 Power-Off_Retract_Count -O--CK   100   100   000    -    62
193 Load_Cycle_Count        -O--CK   099   099   000    -    2192
194 Temperature_Celsius     -O---K   033   048   000    -    33 (128 0 0 0 0)
197 Current_Pending_Sector  -O--C-   100   100   000    -    0
198 Offline_Uncorrectable   ----C-   100   100   000    -    0
199 UDMA_CRC_Error_Count    -OSRCK   200   188   000    -    14
240 Head_Flying_Hours       ------   100   253   000    -    3364h+34m+16.017s
241 Total_LBAs_Written      ------   100   253   000    -    50164462126
242 Total_LBAs_Read         ------   100   253   000    -    110236689950
                            ||||||_ K auto-keep
                            |||||__ C event count
                            ||||___ R error rate
                            |||____ S speed/performance
                            ||_____ O updated online
                            |______ P prefailure warning

General Purpose Log Directory Version 1
SMART           Log Directory Version 1 [multi-sector log support]
Address    Access  R/W   Size  Description
0x00       GPL,SL  R/O      1  Log Directory
0x01           SL  R/O      1  Summary SMART error log
0x02           SL  R/O      5  Comprehensive SMART error log
0x03       GPL     R/O      5  Ext. Comprehensive SMART error log
0x06           SL  R/O      1  SMART self-test log
0x07       GPL     R/O      1  Extended self-test log
0x09           SL  R/W      1  Selective self-test log
0x10       GPL     R/O      1  SATA NCQ Queued Error log
0x11       GPL     R/O      1  SATA Phy Event Counters log
0x21       GPL     R/O      1  Write stream error log
0x22       GPL     R/O      1  Read stream error log
0x80-0x9f  GPL,SL  R/W     16  Host vendor specific log
0xa1       GPL,SL  VS      20  Device vendor specific log
0xa2       GPL     VS    4496  Device vendor specific log
0xa8       GPL,SL  VS     129  Device vendor specific log
0xa9       GPL,SL  VS       1  Device vendor specific log
0xab       GPL     VS       1  Device vendor specific log
0xb0       GPL     VS    5176  Device vendor specific log
0xbe-0xbf  GPL     VS   65535  Device vendor specific log
0xc0       GPL,SL  VS       1  Device vendor specific log
0xc1       GPL,SL  VS      10  Device vendor specific log
0xc4       GPL,SL  VS       5  Device vendor specific log
0xe0       GPL,SL  R/W      1  SCT Command/Status
0xe1       GPL,SL  R/W      1  SCT Data Transfer

SMART Extended Comprehensive Error Log Version: 1 (5 sectors)
No Errors Logged

SMART Extended Self-test Log Version: 1 (1 sectors)
Num  Test_Description    Status                  Remaining  LifeTime(hours)  LBA_of_first_error
# 1  Extended offline    Completed without error       00%      7716         -
# 2  Extended offline    Completed without error       00%      7678         -
# 3  Conveyance offline  Completed without error       00%      7674         -
# 4  Short offline       Completed without error       00%      7674         -
# 5  Extended offline    Completed without error       00%      7656         -
# 6  Extended offline    Completed without error       00%      7619         -
# 7  Conveyance offline  Completed without error       00%      7614         -
# 8  Short offline       Completed without error       00%      7614         -
# 9  Extended offline    Completed without error       00%      7603         -
#10  Conveyance offline  Completed without error       00%      7599         -
#11  Short offline       Completed without error       00%      7599         -
#12  Conveyance offline  Completed without error       00%      7599         -
#13  Short offline       Completed without error       00%      7599         -
#14  Conveyance offline  Completed without error       00%      7598         -
#15  Short offline       Completed without error       00%      7598         -
#16  Short offline       Completed without error       00%      7565         -
#17  Short offline       Completed without error       00%      7565         -
#18  Extended offline    Completed without error       00%        57         -
#19  Conveyance offline  Completed without error       00%        53         -

SMART Selective self-test log data structure revision number 1
 SPAN  MIN_LBA  MAX_LBA  CURRENT_TEST_STATUS
    1        0        0  Not_testing
    2        0        0  Not_testing
    3        0        0  Not_testing
    4        0        0  Not_testing
    5        0        0  Not_testing
Selective self-test flags (0x0):
  After scanning selected spans, do NOT read-scan remainder of disk.
If Selective self-test is pending on power-up, resume after 0 minute delay.

SCT Status Version:                  3
SCT Version (vendor specific):       522 (0x020a)
SCT Support Level:                   1
Device State:                        Active (0)
Current Temperature:                    33 Celsius
Power Cycle Min/Max Temperature:     26/35 Celsius
Lifetime    Min/Max Temperature:     18/48 Celsius
Under/Over Temperature Limit Count:   0/0

SCT Data Table command not supported

SCT Error Recovery Control command not supported

Device Statistics (GP/SMART Log 0x04) not supported

SATA Phy Event Counters (GP Log 0x11)
ID      Size     Value  Description
0x000a  2            3  Device-to-host register FISes sent due to a COMRESET
0x0001  2            0  Command failed due to ICRC error
0x0003  2            0  R_ERR response for device-to-host data FIS
0x0004  2            0  R_ERR response for host-to-device data FIS
0x0006  2            0  R_ERR response for device-to-host non-data FIS
0x0007  2            0  R_ERR response for host-to-device non-data FIS

+-----------------------------------------------------------------------------
+ Finished burn-in of /dev/sdb : Sun Sep 22 07:49:15 EDT 2019
+-----------------------------------------------------------------------------
